date,category,article title
01/12/2017, Finance ,Stocks Slide on Wall Street After Michael Flynn’s Guilty Plea in Trump-Russia Investigation
01/12/2017, Finance ,"Term Sheet — Friday, December 1"
04/12/2017, Finance ,Calm Down. Cryptocurrency Is Still a Microscopic Asset in the Financial Market
04/12/2017, Finance ,Could Israel Become a Hub for Bitcoin and Other Cryptocurrency?
04/12/2017, Finance ,Winklevoss Twins Used Facebook Payout to Become Bitcoin Billionaires
04/12/2017, Finance ,Term Sheet — Monday December 4
04/12/2017, Finance ,21st Century Fox Restarts Talks to Sell Most of the Company to Disney
05/12/2017, Finance ,Why Wall Street Is Skeptical of the CVS-Aetna Deal
05/12/2017, Finance ,Bitcoin Futures Are Coming and Regulators Are Racing to Catch Up
05/12/2017, Finance ,Term Sheet — Tuesday December 5
05/12/2017, Finance ,Robert Mueller Wants to Know About Deutsche Bank’s Relationship With Donald Trump
06/12/2017, Finance ,Bitcoin Is Such a Frenzy in South Korea That It Costs More There
06/12/2017, Finance ,"Bitcoin Is Still a ‘Joke,’ These Finance Giants Say"
06/12/2017, Finance ,Why HSBC CEO Stuart Gulliver Isn’t Afraid of Fintech
06/12/2017, Finance ,Term Sheet — Wednesday December 6
06/12/2017, Finance ,Apple Could See Nearly $47 Billion in Benefits From the Republican Tax Reform
06/12/2017, Finance ,"Bitcoin Surges Above $12,000 For the First Time"
07/12/2017, Finance ,This Is the Real Reason the Stock Market Needs Activist Investors
07/12/2017, Finance ,Morgan Stanley Fires Ex-Congressman Ford After Misconduct Probe
07/12/2017, Finance ,"Goldman, BlackRock, Blackstone Vie to Keep Wall Street Crowns"
07/12/2017, Finance ,President Trump’s Middle-Class Tax Pledges Go Unfulfilled in Senate Bill
07/12/2017, Finance ,Term Sheet — Thursday December 7
07/12/2017, Finance ,Why China’s GDP Growth Rate Tells Us Nothing About Its Economy
07/12/2017, Finance ,4 Best Tech Stocks to Buy for 2018—Instead of Buying Bitcoin
07/12/2017, Finance ,Investing: How the World’s Biggest Money Manager Is Preparing for 2018
07/12/2017, Finance ,The 5 Best Emerging Markets Stocks for 2018: How to Buy the Amazon and Google of China
07/12/2017, Finance ,Why the World’s Biggest Money Manager Thinks Inflation Is Back
07/12/2017, Finance ,Here’s What the World’s Biggest Money Manager Thinks Stocks Will Do Next Year
07/12/2017, Finance ,The 6 Best Stocks to Buy for 2018 Before Robots Take Your Job
07/12/2017, Finance ,The Best Investing Advice for 2018 From Fortune’s Experts
07/12/2017, Finance ,Here’s What the World’s Biggest Money Manager Is Worrying About for 2018
07/12/2017, Finance ,How Fortune’s Best Stocks Crushed the Market in 2017
07/12/2017, Finance ,The 4 Best Biotech and Health Care Stocks to Buy for 2018
07/12/2017, Finance ,The 5 Best Fintech Stocks to Buy for 2018
07/12/2017, Finance ,Inside Elliott Management: How Paul Singer’s Hedge Fund Always Wins
07/12/2017, Finance ,How We Picked Our Best Stocks for 2018
07/12/2017, Finance ,Corporate Profits Are Soaring. Here’s Why It Can’t Last
07/12/2017, Finance ,Why McDonald’s Is One of the 3 Best E-commerce Stocks to Buy for 2018
07/12/2017, Finance ,Why It’s Time for a Stock Market Sobriety Check
07/12/2017, Finance ,All-Tech Investing: The 31 Best Stocks to Buy for 2018 Instead of Apple or Tesla
08/12/2017, Finance ,"Term Sheet — Friday, December 8"
08/12/2017, Finance ,Goldman Sachs Has Practically Vanished from Hong Kong’s IPO Scene
09/12/2017, Finance ,Bitcoin Futures Trading Brings Crypto Into Mainstream Finance
10/12/2017, Finance ,Bitcoin Futures Launch to a Dramatic Start
11/12/2017, Finance ,Bitcoin Futures Started So Hot That Trading Had to Be Halted Twice
11/12/2017, Finance ,Carl Icahn Will Nominate Four Directors to Xerox Board
11/12/2017, Finance ,"Term Sheet — Monday, December 11"
11/12/2017, Finance ,An 82-Year-Old VC Makes a Splash With Young Startups
12/12/2017, Finance ,Bitcoin Began With Men. But Women May Be Cryptocurrency’s Future
12/12/2017, Finance ,"‘Speculative Mania.’ Bitcoin Is More Likely to Appeal to Criminals Than Consumers, RBA Governor Says"
12/12/2017, Finance ,Hedge Funds Flock to Broker That Embraced Bitcoin Futures Early
12/12/2017, Finance ,Bitcoin Short Shortage Keeps Crypto Futures Wobbling Above Spot
12/12/2017, Finance ,Winklevoss Twins Say Futures Are Just the Beginning for Bitcoin
12/12/2017, Finance ,Bitcoin ‘Sect’ Stuns Online Broker With 50-Fold Jump
12/12/2017, Finance ,"Term Sheet — Tuesday, December 12"
12/12/2017, Finance ,Why Your Retirement Plans Need a Reality Check
13/12/2017, Finance ,The Disney Deal Is Set to Value Fox at More Than $75 Billion
13/12/2017, Finance ,‘Highly Speculative Asset.’ The Fed Chair Just Issued a Stark Warning About Bitcoin
13/12/2017, Finance ,Liberty Tax Founder John Hewitt Faces Ouster Amid Sex Scandal Allegations
13/12/2017, Finance ,"Term Sheet — Wednesday, December 13"
13/12/2017, Finance ,How ‘Impact Investing’ Can Put a Profitable Spin on Charity
13/12/2017, Finance ,Why Consulting Can Be Better Than Retiring
13/12/2017, Finance ,How to Invest for a 40-Year Retirement
14/12/2017, Finance ,"This Couple Invested in Bitcoin at $800. Now It’s $17,000 and They’re Donating Everything to a Cancer Hospital"
14/12/2017, Finance ,Why Bitcoin is Surging in the Countries Trying Hardest to Stop It
14/12/2017, Finance ,"Term Sheet — Friday, December 14"
14/12/2017, Finance ,First Came Bitcoin. Then Came Bitcoin Lenders
14/12/2017, Finance ,How Schwab Got Robots to Play Nice With Humans
14/12/2017, Finance ,Kickstarter Says It Won’t Follow Indiegogo Into ICOs
15/12/2017, Finance ,P&G Appoints Activist Investor Nelson Peltz to Board Following Proxy Battle
15/12/2017, Finance ,Final Republican Tax Bill Slashes Corporate Rate
15/12/2017, Finance ,"Term Sheet — Friday, December 15"
15/12/2017, Finance ,A Goldman Sachs Selfie Just Made Twitter $1.2 Billion Bigger
15/12/2017, Finance ,Disney CEO Bob Iger Will See a Massive Payday if the Fox Deal Goes Through
15/12/2017, Finance ,‘Be Prepared to Lose Your Money.’ A British Regulator Has a Warning for Bitcoin Buyers
16/12/2017, Finance ,How Individual Taxpayers Can Exploit the New Tax Bill Right Now
17/12/2017, Finance ,Bitcoin Is Now Trading on the World’s Largest Futures Exchange
18/12/2017, Finance ,The Stock Market Again Closed at New Record Highs on Monday
18/12/2017, Finance ,"Term Sheet — Monday, December 18"
18/12/2017, Finance ,Here’s Why Hershey Just Spent Almost $1 Billion on Popcorn
18/12/2017, Finance ,Ikea Is the Latest Multinational Being Investigated for Avoiding EU Taxes
18/12/2017, Finance ,Taxpayers are Scrambling to Claim Deductions While They Still Can
19/12/2017, Finance ,"Cryptocurrency CEO Warns 1,000% Stock Rise Is ‘Not a Reality’ As Bitcoin Mania Takes Hold"
19/12/2017, Finance ,"Term Sheet — Tuesday, December 19"
19/12/2017, Finance ,The EU’s Brexit Negotiator Is Practicing His Grinch Routine
19/12/2017, Finance ,Wells Fargo Names Mary Mack Head of Consumer Lending
19/12/2017, Finance ,Airbnb Apartment Complexes Could Soon be Coming to the U.S.—Thanks to a $200 Million Investment
19/12/2017, Finance ,A Feud Between Boeing and Bombardier is Casting a Spotlight on U.S.-Canadian Trade Deals
19/12/2017, Finance ,"Warren Buffett’s Berkshire Hathaway Hit a Record of $300,000 a Share"
20/12/2017, Finance ,Online Brokerage E*Trade Is Now Letting Its Customers Trade Cboe Bitcoin Futures
20/12/2017, Finance ,Chipotle Stock Plunges After Reports of Vomiting Employees at L.A. Restaurant
20/12/2017, Finance ,Trump’s Chief Economic Adviser Gary Cohn Says This Is Why He Won’t Buy Bitcoin
20/12/2017, Finance ,"Term Sheet — Wednesday, December 20"
20/12/2017, Finance ,The U.K. Will Make Concessions to EU Banks to Keep Them in London After Brexit
21/12/2017, Finance ,This Iced Tea Company Pivoted to Blockchain. Now its Stock is Up 200%
21/12/2017, Finance ,"Term Sheet — Thursday, December 21"
21/12/2017, Finance ,Emerging Markets: Why India Stocks Could Be Big Winners in 2018
21/12/2017, Finance ,3 Retail Stocks That Amazon Won’t Crush
22/12/2017, Finance ,Why Successful Entrepreneurs Choose Startups Over Stocks
22/12/2017, Finance ,"Term Sheet — Friday, December 22"
22/12/2017, Finance ,"Lawmakers Want to Probe Who Owns HNA Group, the Chinese Giant Taking Over U.S. Companies"
22/12/2017, Finance ,Roche to Buy U.S. Cancer Drugmaker Ignyta for $1.7 Billion
22/12/2017, Finance ,"Bitcoin Price Drops Below $14,000 as Cryptocurrency Competition Heats Up"
22/12/2017, Finance ,Real Estate Developer Woodbridge Is Being Sued Over a $1.2 Billion Ponzi Scheme that Defrauded the Elderly
26/12/2017, Finance ,"Crypto Stocks Rally as Bitcoin Bounces Back Above $15,000"
27/12/2017, Finance ,Hundreds of People Are Standing in Line to Prepay Property Taxes. It Might Be For Nothing
27/12/2017, Finance ,Kanye West Gives Kim Kardashian West Hundreds of Thousands of Dollars Worth of Stock in Five Major Companies
28/12/2017, Finance ,U.S. Renters Paid a Record High $485.6 Billion in 2017: Zillow
28/12/2017, Finance ,"2017 Was a Robust Year for the U.S. Housing Market, Zillow Says"
28/12/2017, Finance ,The U.S. Inflation Mystery Made Economists Look Bad in 2017
28/12/2017, Finance ,Will the Stock Market Crash in 2018? Here’s What Wall Street Predicts
28/12/2017, Finance ,"From Bitcoin to Belize, Here Are Best and Worst Assets of 2017"
28/12/2017, Finance ,Citigroup Fined for Telling Clients to Buy When It Meant Sell
28/12/2017, Finance ,"As Bitcoin Sinks, So Do Stocks With Ties to Cryptocurrencies"
28/12/2017, Finance ,3 Strategies for Cutting a High State Tax Bill
28/12/2017, Finance ,"Jobless Claims Hold Steady, Signaling Solid U.S. Labor Market"
28/12/2017, Finance ,Banks Offer Cash-Strapped Clients a Way to Game Trump’s Tax Plan
28/12/2017, Finance ,Everything You Need to Know About Global Markets in 2018
29/12/2017, Finance ,IRS Issues Tax Rate Guidance for Stockpiled Foreign Income
29/12/2017, Finance ,Goldman Sachs Is Taking a $5 Billion Hit From the Republican Tax Bill
30/12/2017, Finance ,Goldman Sachs Sends Up a Warning Flag About Cryptocurrencies in 2018
30/12/2017, Finance ,Peculiar Year for Markets Defied Almost Everyone’s Expectations
31/12/2017, Finance ,The 10 Biggest Business Scandals of 2017
02/01/2018, Finance ,Marijuana Stocks Soar As California Legalizes Recreational Pot
02/01/2018, Finance ,Why Bitcoin Is Losing Its Luster Among Criminals
02/01/2018, Finance ,"Term Sheet — Tuesday, January 2"
03/01/2018, Finance ,"Weight Watchers Teams Up With DJ Khaled, And Oprah Gets $26 Million Richer"
03/01/2018, Finance ,Bitcoin’s ‘Altcoin’ Cryptocurrency Rivals Are Finally Catching Up
03/01/2018, Finance ,"Term Sheet — Wednesday, January 3"
04/01/2018, Finance ,Here’s The Dow Jones Stocks You Should’ve Invested In After Trump’s Election
04/01/2018, Finance ,"Dow Jones Surpasses 25,000 for the First Time as Stocks Rally Despite Winter Storm"
04/01/2018, Finance ,"Term Sheet — Thursday, January 4"
05/01/2018, Finance ,Tech Stocks Soared In 2017. That Could Hurt You In 2018
05/01/2018, Finance ,Why the Hedge Funder Who Predicted the Recession Is Worried About the Record Stock Market
05/01/2018, Finance ,"Donald Trump Tweets That Stock Market Rises Fastest 1,000 in History. Here’s What History Says."
05/01/2018, Finance ,Capital One CEO Richard Fairbank Just Became a Billionaire
05/01/2018, Finance ,The Owner of Corona Beer Just Made a Bet on Legal Marijuana
05/01/2018, Finance ,"Term Sheet — Friday, January 5"
07/01/2018, Finance ,U.S. Biotech Firm Celgene to Buy Impact Biomedicines for up to $7 Billion
08/01/2018, Finance ,Alibaba Founder Jack Ma Says He’s Reconsidering a Stock Listing in Hong Kong
08/01/2018, Finance ,Jeff Bezos Is Now Worth More Than $105 Billion
08/01/2018, Finance ,Warren Buffett’s Berkshire Hathaway Could Make $37 Billion from Trump’s Tax Cut
08/01/2018, Finance ,"Term Sheet — Monday, January 8"
08/01/2018, Finance ,China’s Richest Woman Just Made $2 Billion in Four Days
09/01/2018, Finance ,Wall Street Bulls Say Stocks Look Cheap. Don’t Be Fooled
09/01/2018, Finance ,Credit Card Debt Hits Highest Levels Since the 2008 Housing Crisis
09/01/2018, Finance ,"Term Sheet — Tuesday, January 9"
10/01/2018, Finance ,Warren Buffett: Tax Cut Will Make Companies More Valuable
10/01/2018, Finance ,Companies’ Stocks Are Skyrocketing When They Pivot to Blockchain. Now Traders Are Getting Rich Off That
10/01/2018, Finance ,"Term Sheet — Wednesday, January 10"
11/01/2018, Finance ,"Term Sheet — Thursday, January 11"
11/01/2018, Finance ,Struggling Xerox Is Reportedly in Deal Talks With Japan’s Fujifilm
12/01/2018, Finance ,"Term Sheet — Friday, January 12"
12/01/2018, Finance ,Fiat Chrysler Is the Latest Company to Give Workers a Big Bonus After U.S. Tax Reform
13/01/2018, Finance ,Taking Clients to Ballgames Will Cost You More Under New Tax Laws
13/01/2018, Finance ,This Country Is Warning Against ‘Risky and Inherently Speculative’ Cryptocurrencies
15/01/2018, Finance ,SoftBank Flirts With Wireless Unit IPO that Could Be Japan’s Biggest in Two Decades
16/01/2018, Finance ,Why Wall Street Is Ignoring “CAPE” Fear
16/01/2018, Finance ,"Term Sheet — Tuesday, January 16"
16/01/2018, Finance ,GE Shares Dive on $6.2 Billion Charge for Problems in Its Finance Unit
16/01/2018, Finance ,The Energizer Bunny Is Buying Rayovac in a $2 Billion Deal
17/01/2018, Finance ,South Korea Is Considering Shutting Down all Virtual Currency Exchanges
17/01/2018, Finance ,"After a Terrible Start to 2018, Bitcoin Rebounds Above $11,000"
17/01/2018, Finance ,Goldman Sachs Posts Its First Quarterly Loss in 6 Years Thanks to Trump’s Tax Bill
17/01/2018, Finance ,A Goldman Sachs Executive Was Robbed of $1.2 Million Worth of Wine
17/01/2018, Finance ,Apple Is Paying $38 Billion to Bring Cash Back to the U.S. Because of the Tax Overhaul
17/01/2018, Finance ,Did Bitcoin Just Burst? How It Compares to History’s Big Bubbles
17/01/2018, Finance ,This Central Bank Has the Worst Track Record for Predicting Inflation
17/01/2018, Finance ,"Term Sheet — Wednesday, January 17"
17/01/2018, Finance ,This Was the Single Most Complained-About Company of 2017
18/01/2018, Finance ,Apple Leads These Companies With Massive Overseas Cash Repatriation Tax Bills
18/01/2018, Finance ,"Term Sheet — Thursday, January 18"
18/01/2018, Finance ,"Bitcoin Roller-Coasters Back Above $11,000 After a Frantic 24 Hours"
18/01/2018, Finance ,China’s Economic Growth Last Year Was Even Better Than Expected
19/01/2018, Finance ,Everything We Know About Donald Trump’s Proposed Border Wall
19/01/2018, Finance ,How Will a Government Shutdown Impact the U.S. Economy? Here’s What the Analysts Say
19/01/2018, Finance ,"Term Sheet — Friday, January 19"
19/01/2018, Finance ,Why Sony and Nintendo Stocks Could Rack Up Higher Scores
22/01/2018, Finance ,How Bank of America Can Catch J.P. Morgan
22/01/2018, Finance ,CEO Optimism in the World Economy Has Reached a Record High
22/01/2018, Finance ,"Term Sheet — Monday, January 22"
23/01/2018, Finance ,How Tesla’s Elon Musk Could Become the World’s Richest Person Without Ever Getting a Paycheck
23/01/2018, Finance ,"Pointing to Trump Tax Cuts, J.P. Morgan Chase to Add 4,000 Jobs in the U.S."
23/01/2018, Finance ,Bitcoin Forking Madness Could Result in 50 Splits This Year
23/01/2018, Finance ,"Term Sheet — Tuesday, January 23"
24/01/2018, Finance ,"Meet Jerome Powell, One of the Most Powerful U.S. Leaders After President Donald Trump"
24/01/2018, Finance ,Here’s What You Should Know About That Survey Saying 1 in 6 Millennials Has $100K in Savings
24/01/2018, Finance ,"Term Sheet — Wednesday, January 24"
24/01/2018, Finance ,Thousands of Starbucks Employees Are Getting Raises After GOP Tax Cuts
24/01/2018, Finance ,Disney Is the Latest Company to Give Cash Bonuses to Employees Following Tax Reform
24/01/2018, Finance ,UBS Chairman Warns of ‘Massive’ Potential Drop in Bitcoin
25/01/2018, Finance ,U.S. Dollar Bounces as Trump Goes Back on Treasury Secretary Mnuchin’s Comments
25/01/2018, Finance ,"Here’s One Major Sign That Markets Can Run Even Higher, According to the Head of the World’s Biggest Money Manager"
25/01/2018, Finance ,"Term Sheet — Thursday, January 25"
26/01/2018, Finance ,"Term Sheet — Friday, January 26"
28/01/2018, Finance ,‘Jackpotting’ Targets U.S. ATMs to Make Them Spit Out Cash
29/01/2018, Finance ,Wynn Resorts Loses $3.5 Billion After Sexual Harassment Allegations Surface About Steve Wynn
29/01/2018, Finance ,A Court Is Going to Decide Whether the Government Can Regulate Bitcoin Like Stocks
29/01/2018, Finance ,"Term Sheet — Monday, January 29"
30/01/2018, Finance ,J.P. Morgan’s Jamie Dimon Is Most Likely Not Running Against Trump in 2020
30/01/2018, Finance ,How Tax Reform Makes Goldman Sachs a Winner—and a Loser
30/01/2018, Finance ,"Term Sheet — Tuesday, January 30"
30/01/2018, Finance ,Stocks Are Dropping for a Second Day After Rising for So Long. What You Need to Know
31/01/2018, Finance ,Is Trump’s Antitrust Policy Pro-U.S. Business? A New FTC Action Casts Doubt
31/01/2018, Finance ,You Can Thank Boeing and Corporate Tax Cuts for 94% of the Dow’s Rise Today
31/01/2018, Finance ,How to Steal $500 Million in Cryptocurrency
31/01/2018, Finance ,"Term Sheet — Wednesday, January 31"
31/01/2018, Finance ,Fujifilm Is Taking Over Xerox in a $6.1 Billion Deal
01/02/2018, Finance ,A New Lawsuit Claims Morgan Stanley Still Discriminates Based on Race
01/02/2018, Finance ,"Term Sheet — Thursday, February 1"
02/02/2018, Finance ,Janet Yellen’s Last Act at the Federal Reserve: Punishing Wells Fargo
02/02/2018, Finance ,Forecast of Double-Digit Stock Returns Deserves the Right Name: Fantasyland
02/02/2018, Finance ,Here Are the Signs the Bitcoin Bubble Is About to Burst
02/02/2018, Finance ,"Term Sheet — Friday, February 2"
02/02/2018, Finance ,Wall Street Increases Amazon Targets as Shares Pop After Results
02/02/2018, Finance ,Why UPS Is Buying 14 More 747s
03/02/2018, Finance ,Bitcoin Newbies Are Getting Crushed
03/02/2018, Finance ,What to Expect From Federal Reserve Chair Jerome Powell’s Tenure
04/02/2018, Finance ,Why Stock Market Investors Should Root For a High-Scoring Super Bowl
04/02/2018, Finance ,Outgoing Fed Chair Janet Yellen Says Prices High for U.S. Stocks and Real Estate
05/02/2018, Finance ,Trump’s White House Is Worried About the Stock Market. Should You Be?
05/02/2018, Finance ,"‘It Was Excessive Confidence.’ Dow Jones Industrial Average Plunges 1,100 in Biggest One-Day Selloff Ever"
05/02/2018, Finance ,Here’s the Logic Behind a Private Equity Billionaire’s Dramatic Stock Prediction
05/02/2018, Finance ,Why Blackstone Billionaire Tony James Expects Stocks to Drop 20% This Year
05/02/2018, Finance ,Will Companies Compete Away the Tax Cut’s Bounty?
05/02/2018, Finance ,"Term Sheet — Monday, February 5"
06/02/2018, Finance ,What Investors Can Expect After the Biggest One-Day Selloff in History
06/02/2018, Finance ,These Companies Were Hit Hardest by the Big Selloff
06/02/2018, Finance ,‘These Are the Rumblings.’ Carl Icahn Warns the Stock Market Will Implode
06/02/2018, Finance ,This 24-Year-Old Made Millions in Bitcoin and Quit His Job. Here’s How He Did It
06/02/2018, Finance ,Fake KodakCoin Is Already Being Sold by Scammers
06/02/2018, Finance ,See Traders React to the Dow’s Biggest One-Day Drop in History
06/02/2018, Finance ,"As Markets Plunge and Volatility Surges, This Stock Is Soaring"
06/02/2018, Finance ,Wall Street Opens Down a Day After Biggest Decline Since 2011
06/02/2018, Finance ,"Term Sheet — Tuesday, February 6"
06/02/2018, Finance ,Stock Market Is Set to Plunge Again At Open
06/02/2018, Finance ,European Markets Continue Slide Following Asia and U.S. Sell-Offs
07/02/2018, Finance ,Wall Street’s Hottest VIX Trades Burn Amateur Investors
07/02/2018, Finance ,People Are Going Into Debt to Buy Bitcoin
07/02/2018, Finance ,Steve Wynn Could Resign With a $300 Million Bonus
08/02/2018, Finance ,"What Drove Stocks Into Correction Territory, According to Investors"
08/02/2018, Finance ,"No, The Stock Market Isn’t Crashing. But The Dow Is in Correction Territory"
08/02/2018, Finance ,Cryptocurrency Critic Says He’s Worried About His Safety
08/02/2018, Finance ,"Term Sheet — Thursday, February 8"
08/02/2018, Finance ,The Next Warren Buffett? Larry Fink’s Latest BlackRock Venture Mimics Berkshire Hathaway
09/02/2018, Finance ,Global Markets Shed $5.2 Trillion During the Dow’s Stock Market Correction
09/02/2018, Finance ,"Bitcoin Would Dominate in a ‘Dystopian World Without Trust,’ Economist Says"
09/02/2018, Finance ,"Jeff Bezos, Warren Buffett, and Larry Ellison Have Lost a Combined $19 Billion in the Past Week"
09/02/2018, Finance ,"Term Sheet — Friday, February 9"
09/02/2018, Finance ,Why America’s About to Pivot from Cheering the Economy to Fearing the Debt
09/02/2018, Finance ,A Week of Investor Whiplash: What’s Behind the Stock Market’s Volatility
10/02/2018, Finance ,"VIX Surge Hands 8,600% Profit to Little-Known Hedge Fund"
10/02/2018, Finance ,The U.S. Junk-Bond Market Just Had Its Worst Week in 2 Years
10/02/2018, Finance ,What Are Backwardation and Contango? Here’s What You Should Know
11/02/2018, Finance ,The Equifax Hack Exposed More Data Than Previously Reported
12/02/2018, Finance ,"Term Sheet — Monday, February 12"
13/02/2018, Finance ,JPMorgan Chase Is Taking Its Fund for Minority-Owned Businesses to Two More Cities
13/02/2018, Finance ,"Term Sheet — Tuesday, February 13"
14/02/2018, Finance ,Coinbase Releases Tool for Merchants to Accept Cryptocurrencies
14/02/2018, Finance ,"Bitcoin Is a ‘Noxious Poison,’ Billionaire Says"
14/02/2018, Finance ,What’s Really Worrying About the Inflation Fears That Hit the Stock Market
14/02/2018, Finance ,Danone to Sell Stake in Japan’s Yakult for $1.8 Billion
14/02/2018, Finance ,Here’s What 1999 Warren Buffett Might Say About the 2018 Stock Market
14/02/2018, Finance ,"Term Sheet — Wednesday, February 14"
15/02/2018, Finance ,"Trump ‘Strongly’ Favors Imposing Online Sales Tax, Mnuchin Says"
15/02/2018, Finance ,Bitcoin ‘Scam’ Triggers Police Search Across Europe
15/02/2018, Finance ,Healthcare Prices to Outpace Inflation for the First Time Since 2010
15/02/2018, Finance ,"Term Sheet — Thursday, February 15"
15/02/2018, Finance ,Amazon Is Now More Valuable Than Microsoft and Only 2 Other Companies Are Worth More
15/02/2018, Finance ,Teva Is Drowning in Debt and Firing Thousands of Employees. Now Warren Buffett Is Interested
15/02/2018, Finance ,Cisco’s Plan to Bring $67 Billion Back to the U.S. Could Be a Major Windfall for Its Investors
16/02/2018, Finance ,Can America’s Economy Keep Up With Its Debt?
16/02/2018, Finance ,"Term Sheet — Friday, February 16"
16/02/2018, Finance ,New Tax Cuts Will Save Billions. But for Whom?
16/02/2018, Finance ,The SEC Just Blocked the Chinese Takeover of a U.S. Stock Exchange
17/02/2018, Finance ,"This Is Warren Buffett’s Top Equity Holding, Surpassing Wells Fargo"
19/02/2018, Finance ,Sweden’s Mission to Go Cashless May Have Gone Too Far
19/02/2018, Finance ,‘Uncharted Territory:’ Goldman Sachs Issues Dire Warning About Federal Spending
19/02/2018, Finance ,Noble Group Warns Losses May Near $5 Billion as It Pursues a Deal
20/02/2018, Finance ,Kate Upton’s Sexual Harassment Allegations Are Costing This Exec Millions of Dollars
20/02/2018, Finance ,Sprint Is Selling $1 Billion in Junk Bonds to Upgrade Its Network
20/02/2018, Finance ,The Happiest People on Earth Are Spending More Money Than They Have in Years
20/02/2018, Finance ,This $42 Billion Fund Manager Says the Selloff Hit the Wrong Stocks
20/02/2018, Finance ,"Term Sheet — Tuesday, February 20"
21/02/2018, Finance ,"Donald Trump Might Be Cheering Low Unemployment, But Here’s Why Businesses Aren’t"
21/02/2018, Finance ,JPMorgan Unveils Its Plans for New Manhattan Headquarters
21/02/2018, Finance ,"Term Sheet — Wednesday, February 21"
22/02/2018, Finance ,Guns and More Guns: Will Wall Street Ever Let Go of Firearms?
22/02/2018, Finance ,This Is the Price of Admission to Get Into the 1%
22/02/2018, Finance ,Teacher Pension Funds in 12 States Are Invested in Gun Stocks
22/02/2018, Finance ,"Term Sheet — Thursday, February 22"
22/02/2018, Finance ,Why Apple’s Tim Cook Is No Fan of the Quarterly Earnings Report
22/02/2018, Finance ,Here Are the 26 Big U.S. Companies With the Most Cash Stashed Overseas
23/02/2018, Finance ,Why the Chinese Government Now Controls an Iconic New York City Hotel
23/02/2018, Finance ,"Term Sheet — Friday, February 23"
23/02/2018, Finance ,General Mills Is Buying Blue Buffalo Pet Food for $8 Billion
23/02/2018, Finance ,Companies Are Starting to Back Away From the Gun Industry and NRA
24/02/2018, Finance ,Warren Buffett Is on the Hunt for a ‘Huge’ Acquisition
24/02/2018, Finance ,Warren Buffett Warns That Safe-Looking Bonds Can Be Risky
24/02/2018, Finance ,How Berkshire Hathaway Gained $29 Billion from the New Tax Law
24/02/2018, Finance ,Citigroup Is Refunding $335 Million to Credit Card Customers
26/02/2018, Finance ,"Crypto Legend Who Bought Pizza With 10,000 Bitcoin Is Back At It"
26/02/2018, Finance ,Self-Proclaimed Inventor of Bitcoin Accused of Swindling $5 Billion in Cryptocurrency
26/02/2018, Finance ,Bitcoin Is Giving Divorcing Couples Something New to Fight About
26/02/2018, Finance ,"Term Sheet — Monday, February 26"
26/02/2018, Finance ,Weinstein Co. to File for Bankruptcy After Deal Collapses
27/02/2018, Finance ,Goldman Sachs Said to Be Weighing $1.4 Billion Sale of London Headquarters
27/02/2018, Finance ,Why Millennials Are Ditching Credit Cards
