date,category,article title
27/02/2018, Finance ,Fed Chair Sees Gradual Rate Hikes Amid Strong U.S. Growth Outlook
27/02/2018, Finance ,"Term Sheet — Tuesday, February 27"
27/02/2018, Finance ,8 Executives Reveal How They Woo Clients
28/02/2018, Finance ,Ackman Calls It Quits on Herbalife as Pershing Square Restructures
28/02/2018, Finance ,"Bill Ackman Is Said to Cede Herbalife Fight, Ending 5-Year Saga"
28/02/2018, Finance ,Spotify Finally Filed for an IPO
28/02/2018, Finance ,Bain’s Head of Private Equity Says Donald Trump’s Tax Plan Will Be a Positive for the Industry
01/03/2018, Finance ,Another 2.4 Million Equifax Customers Are About to Find Out Their Identities Were Stolen in Hack
01/03/2018, Finance ,This Tool Will Tell You If You Should Change Your Tax Withholding
01/03/2018, Finance ,6 Takeaways From Spotify’s Unusual IPO Filing
01/03/2018, Finance ,"Term Sheet — Thursday, March 1"
02/03/2018, Finance ,"After Trump’s Steel and Aluminum Trade Tariff Announcement, Dow Drops Another 300 Points"
02/03/2018, Finance ,"Term Sheet — Friday, March 2"
02/03/2018, Finance ,How Blackstone CEO Stephen Schwarzman Got $786 Million For a Year’s Work
03/03/2018, Finance ,Axa Is Said to Be in Advanced Talks to Buy Insurer XL Group
05/03/2018, Finance ,Why Some Investors Are Refusing to Buy Walmart Stock
05/03/2018, Finance ,"Term Sheet — Monday, March 5"
05/03/2018, Finance ,Axa Is Buying Insurer XL Group for $15.3 Billion as Natural Disasters Push Up Prices
06/03/2018, Finance ,Uber Has Burned Through $10.7 Billion in 9 Years. Here’s Where the Money Went
06/03/2018, Finance ,NYSE Fined $14 Million by SEC for Series of Rule Violations
06/03/2018, Finance ,‘Dow Vigilantes’ Are Retaliating Against President Trump After Tariff Announcement
06/03/2018, Finance ,Why WeWork Just Acquired a Content Marketing Company
06/03/2018, Finance ,"Term Sheet — Tuesday, March 6"
07/03/2018, Finance ,Why Gary Cohn Was Right About Tariffs
07/03/2018, Finance ,"As Gary Cohn Resigns, Goldman Sachs Loses its ‘Partner’ in Trump White House"
07/03/2018, Finance ,Bitcoin’s Famed Tokyo Whale Sold $400 Million and He’s Not Done Yet
07/03/2018, Finance ,These U.S. Businesses Are Most at Risk From a Trade War With China
07/03/2018, Finance ,The Net Worth of Departed Trump Advisor Gary Cohn
07/03/2018, Finance ,Oprah Just Sold Part of Her Weight Watchers Stock. Here’s Why
07/03/2018, Finance ,"Term Sheet — Wednesday, March 7"
07/03/2018, Finance ,CVS Bond Buyers Get $300 Million Windfall After Mega Sale
07/03/2018, Finance ,This Venture Capitalist Says SoftBank Is Creating a Subset of ‘Untouchable’ Companies
08/03/2018, Finance ,"Term Sheet — Thursday, March 8"
08/03/2018, Finance ,Cigna Is Buying Express Scripts in a $54 Billion Health Industry Deal
09/03/2018, Finance ,Martin Shkreli’s Net Worth Was Finally Revealed at His Sentencing
09/03/2018, Finance ,"Goldman Sachs CEO Lloyd Blankfein to Step Down, Report Says"
09/03/2018, Finance ,"Term Sheet — Friday, March 9"
09/03/2018, Finance ,What To Know About Today’s Monster Jobs Report
10/03/2018, Finance ,Why ‘Full Employment’ Doesn’t Mean Everyone Has a Job
12/03/2018, Finance ,5 Things to Know About Dow’s New Openly-Gay CEO Jim Fitterling
12/03/2018, Finance ,Goldman Sachs Names David Solomon as Next President as Lloyd Blankfein Prepares to Exit
12/03/2018, Finance ,"Term Sheet — Monday, March 12"
12/03/2018, Finance ,"This Crypto Exchange Is Offering a $250,000 Bounty for Hacker Tip-Offs"
13/03/2018, Finance ,Winklevoss Twins Have a Plan to Police Cryptocurrency Trading
13/03/2018, Finance ,Wall Street Seems Little Concerned by Rex Tillerson’s Ouster. But Here’s Why It Should Be
13/03/2018, Finance ,A Goldman Exec Picks His Favorite New York Dining Spots
13/03/2018, Finance ,"Term Sheet — Tuesday, March 13"
14/03/2018, Finance ,Larry Kudlow Will Be Trump’s Top Economic Adviser. Here Are His Best and Worst Calls
14/03/2018, Finance ,Former Equifax CIO Jun Ying Accused of Insider Trading
14/03/2018, Finance ,"Term Sheet — Wednesday, March 14"
14/03/2018, Finance ,Google Will Ban Online Ads for Cryptocurrencies and Initial Coin Offerings
15/03/2018, Finance ,"Term Sheet — Thursday, March 15"
15/03/2018, Finance ,How Debt Could Blow Up the Trump Economy
16/03/2018, Finance ,Goldman Sachs Pays Female Staff 56% Less Than Male Colleagues in U.K.
16/03/2018, Finance ,"Term Sheet — Friday, March 16"
16/03/2018, Finance ,"Google Doodle Just Honored George Peabody, Financier Who Became the ‘Father of Modern Philanthropy’"
16/03/2018, Finance ,Here’s What Elizabeth Warren Thinks About Wells Fargo CEO Tim Sloan’s Pay Raise
17/03/2018, Finance ,Brace Yourselves. It’s Going to Be a Particularly Busy Week in the World Economy
19/03/2018, Finance ,"Term Sheet — Monday, March 19"
20/03/2018, Finance ,‘Going Into the Lion’s Cage.’ Only 14 Women in the World Lead Commodity Houses
20/03/2018, Finance ,"Term Sheet — Tuesday, March 20"
21/03/2018, Finance ,Gun Owners Furious After YouTube Cracks Down on Popular Firearms Videos
21/03/2018, Finance ,Federal Reserve Raises Rates – and Forecasts Steeper Hikes as Economy Soars
21/03/2018, Finance ,A Short History of the U.S. Not Winning Trade Wars
21/03/2018, Finance ,"Term Sheet — Wednesday, March 21"
21/03/2018, Finance ,Bayer Just Got EU Approval for Its Monsanto Deal—With Conditions
21/03/2018, Finance ,"First Microsoft, Now Alphabet. Amazon Passes Another Giant to Become The Second Most Valuable U.S. Company"
22/03/2018, Finance ,"Term Sheet — Thursday, March 22"
22/03/2018, Finance ,How Venture Capital Mega-Funds Are Widening the Funding Gap
24/03/2018, Finance ,The World’s Richest People Have Lost $436 Billion in the Past 2 Months
26/03/2018, Finance ,"Term Sheet — Monday, March 26"
26/03/2018, Finance ,Why These 3 Beaten-Down Stocks Are Poised for Big Comebacks
26/03/2018, Finance ,A Cyber Gang Stole $1 Billion by Hacking Banks and ATMs. Now Police Say They’ve Caught the Mastermind
27/03/2018, Finance ,Why the Stock Market Is Jumping After Its Worst Week in 2 Years
27/03/2018, Finance ,"Term Sheet — Tuesday, March 27"
28/03/2018, Finance ,"Tesla Shares Fall to Lowest Point in a Year on Model 3 Worries, Crash Probe"
28/03/2018, Finance ,The Air Force Could Lose 590 F-35 Fighters Because It Can’t Afford to Maintain Them
28/03/2018, Finance ,Equifax Fills CEO Slot After Six-Month Vacancy
28/03/2018, Finance ,"Term Sheet — Wednesday, March 28"
28/03/2018, Finance ,Brexit Won’t Kill As Many U.K. Finance Jobs As We Once Thought
29/03/2018, Finance ,President Trump Claims Amazon Pays “Little or No Taxes.” Here’s Where He’s Wrong
29/03/2018, Finance ,The World’s Richest Man Just Lost $10.7 Billion as Trump Tweets About Amazon
29/03/2018, Finance ,"Term Sheet — Wednesday, March 29"
29/03/2018, Finance ,Your Chances of an IRS Tax Audit Are the Lowest in 15 Years
29/03/2018, Finance ,A $75 Million Lifeline Means Bankrupt Remington Can Keep Making Guns For Now
30/03/2018, Finance ,"Term Sheet — Friday, March 30"
02/04/2018, Finance ,Spotify’s CEO Reveals Why He’s Not Doing a Traditional IPO
02/04/2018, Finance ,These Are the 128 U.S. Products China Is Enacting Tariffs On
02/04/2018, Finance ,The Stock Market Is Having its Worst Second Quarter Since the Great Depression
02/04/2018, Finance ,President Trump Is Tweeting About Amazon Again — and its Stock Price Is Falling
02/04/2018, Finance ,"Term Sheet — Monday, April 3"
02/04/2018, Finance ,The 3 Best Bank Stocks for an Aging Bull Market
03/04/2018, Finance ,"Term Sheet — Tuesday, April 3"
03/04/2018, Finance ,J.P. Morgan Is Getting Sued Over the Suicide of a Star Broker Who Was Forced to Retire
04/04/2018, Finance ,Why Boeing Shares Are Falling on the News of Chinese Tariffs
04/04/2018, Finance ,Term Sheet — Wednesday April 4
04/04/2018, Finance ,Stocks Set to Plunge Nearly 500 Points on China Trade War Fears
05/04/2018, Finance ,Investors Are Pulling Out of Bill Ackman’s Hedge Fund at a ‘Rapid Pace’
05/04/2018, Finance ,Term Sheet — Thursday April 5
05/04/2018, Finance ,J.P. Morgan CEO Jamie Dimon Hails the GOP Tax Cut Without Praising Trump in Letter to Shareholders
06/04/2018, Finance ,Term Sheet — Friday April 6
06/04/2018, Finance ,ICOs Are ‘Absolutely Not’ All Fraudulent Says the Chairman of the SEC
08/04/2018, Finance ,Deutsche Bank Is Leaning Toward Christian Sewing as Next CEO
09/04/2018, Finance ,U.S. Budget Deficit Expected to Surpass $1 Trillion by 2020
09/04/2018, Finance ,"Term Sheet — Monday, April 9"
10/04/2018, Finance ,Having Kids Widens the Wage Gap. But These Women Are More Likely to Bounce Back
10/04/2018, Finance ,Trade War Fears Abate After China’s Xi Jinping Cuts Car Import Tariffs
10/04/2018, Finance ,What Uber’s Acquisition of JUMP Bikes Means for the Bike-Share Market
10/04/2018, Finance ,"Term Sheet — Tuesday, April 10"
11/04/2018, Finance ,JPMorgan Sued Over ‘Sky-High’ Fees for Cryptocurrency Purchases
11/04/2018, Finance ,Marijuana Stocks Spike After Ex-House Speaker John Boehner Joins Cannabis Company Board
11/04/2018, Finance ,Bank of America Will Stop Lending to Companies Making Assault-Style Guns
11/04/2018, Finance ,"Term Sheet — Wednesday, April 11"
12/04/2018, Finance ,GE Considers a Spinoff or Public Offering for its Transportation Business
12/04/2018, Finance ,Term Sheet — Thursday April 12
13/04/2018, Finance ,Wells Fargo Could Be Fined $1 Billion For Abusing Car Loans and Mortgages
13/04/2018, Finance ,Goldman Sachs Says Facebook Unfairly Dragged Tech Stocks Down
13/04/2018, Finance ,Term Sheet — Friday April 13
13/04/2018, Finance ,The London Stock Exchange Finally Has Found Its New CEO at Goldman Sachs
16/04/2018, Finance ,Russia Blocked Telegram. Now Its CEO Says Private Information Could Fall to U.S. Hands
16/04/2018, Finance ,Allegiant Air CEO’s Net Worth Is $52 Million Lower After 60 Minutes Segment Questions Safety
16/04/2018, Finance ,Here’s How Long It Takes to Get Your Tax Refund
16/04/2018, Finance ,Term Sheet — Monday April 16
16/04/2018, Finance ,Why Big Data Could Create Big Problems in the Stock Market
17/04/2018, Finance ,The Big Banks Are Reporting Record Profits Thanks in Part to President Trump’s Tax Cuts
17/04/2018, Finance ,Twitter Shares Are Having an Even Bigger Day Than Netflix
17/04/2018, Finance ,Morgan Stanley Warns Investors: The Best Times May Be Near an End
17/04/2018, Finance ,"Cryptocurrency Billionaire, 53, Dies in Drug Rehab in Mexico After Battle With Addiction"
17/04/2018, Finance ,Term Sheet — Tuesday April 17
18/04/2018, Finance ,How Trump’s Tariffs Are Squeezing His Farmer Support Base
18/04/2018, Finance ,This Is How Much Money the World Owes
18/04/2018, Finance ,Early Facebook Backer Teams With Snoop Dogg to Invest in Cannabis Startup
18/04/2018, Finance ,"42% of Americans Have Less Than $10,000 Saved For Retirement"
18/04/2018, Finance ,Term Sheet — Wednesday April 18
18/04/2018, Finance ,Parkland Survivor Wants Investors to Boycott BlackRock and Vanguard
19/04/2018, Finance ,Finland’s Basic Income Experiment Will End in 2019
19/04/2018, Finance ,14 Million People Waited Until the Last Minute to File Their Taxes
19/04/2018, Finance ,Term Sheet — Thursday April 19
20/04/2018, Finance ,What It’s Like to Be a Soybean Farmer During a Trade War
20/04/2018, Finance ,Term Sheet — Friday April 20
20/04/2018, Finance ,Ex-SunTrust Employee May Have Tried Sharing 1.5 Million Customers’ Data
20/04/2018, Finance ,Why Stock Market Buybacks Should Make Investors Nervous
20/04/2018, Finance ,Wells Fargo Will Pay $1 Billion to Settle Probes Into Mistreating Consumers
20/04/2018, Finance ,GE Finally Got Some Good News
20/04/2018, Finance ,‘This Was an Operational Error.’ Deutsche Bank Accidentally Transferred $35 Billion It Didn’t Owe
23/04/2018, Finance ,Here’s How the China-U.S. Tariff Talks May Already Be Hurting America’s Job Growth
23/04/2018, Finance ,"Term Sheet — Monday, April 23"
24/04/2018, Finance ,Microsoft Becomes Second Most Valuable Company For First Time Since 2015
24/04/2018, Finance ,Why You Should Care That the 10-Year Treasury Yield Just Reached 3%
24/04/2018, Finance ,Bitcoin Is One of the Few Things Surging Amid a Sea of Losses
24/04/2018, Finance ,Billionaire Vinod Khosla Wants the Supreme Court to Keep People Off His Beach
24/04/2018, Finance ,"Term Sheet — Tuesday, April 24"
25/04/2018, Finance ,Rage at Globalism Is Just the Beginning
25/04/2018, Finance ,CFPB Director Mick Mulvaney Urges Bankers to Pay for Influence
25/04/2018, Finance ,LendingClub Accused by U.S. of Deception on Hidden Loan Fees
25/04/2018, Finance ,Why Some Cryptocurrencies Are Only for the Wealthy
25/04/2018, Finance ,Winklevoss Twins Hire Nasdaq to Keep Cheaters Off Cryptocurrency Market
25/04/2018, Finance ,"Term Sheet — Wednesday, April 25"
26/04/2018, Finance ,"As Chipotle Soars on Turnaround Hopes, Troubled Hedge Fund Titan Bill Ackman Gets a Boost"
26/04/2018, Finance ,Ex-HSBC Currency Trader Mark Johnson Sentenced to 2 Years in Prison
26/04/2018, Finance ,Deutsche Bank Is Said to Be Planning Cuts to U.S. Jobs
26/04/2018, Finance ,The Labor Department Is Looking Into Wells Fargo’s 401(k) Policies
26/04/2018, Finance ,"Kanye West Tweets About Starting VC Fund, Meeting With Billionaire Peter Thiel"
26/04/2018, Finance ,"Term Sheet — Thursday, April 26"
26/04/2018, Finance ,Why the Next 9 Days Are So Critical for the U.S. Economy
27/04/2018, Finance ,Here’s Who Isn’t Winning From Denuclearization Talks and Friendlier North Korea-South Korea Relations
27/04/2018, Finance ,Sequoia Capital Is On Track To Raise $8 Billion For Its Monster Fund
27/04/2018, Finance ,"Term Sheet — Friday, April 27"
27/04/2018, Finance ,Will Exxon Reward Investors? 5 Things to Watch in Earnings
27/04/2018, Finance ,Want to Trade Samsung Stock Monday? You’ll Just Have to Wait
30/04/2018, Finance ,"Sorry Coastal Elites, the Best Cities to Start a Business Right Now Are in ‘Fly Over’ States"
30/04/2018, Finance ,"Term Sheet — Monday, April 30"
30/04/2018, Finance ,Marriott Vacations Is Making a $4.7 Billion Bet on Luxury Timeshare Resorts
30/04/2018, Finance ,Apple Will Probably Report Bad iPhone X News Tuesday. Here’s How Tim Cook May Try to Fix the Problem
01/05/2018, Finance ,"U.S.-China Trade Tariffs Could Set Back Much of Trump Job Gains, Says Study"
01/05/2018, Finance ,"Term Sheet — Tuesday, May 1"
01/05/2018, Finance ,Pfizer Shares Deflate After Another Quarter Without a Big Transaction
01/05/2018, Finance ,What to Expect From Apple’s Earnings Report Tuesday
02/05/2018, Finance ,"Fed Votes to Keep Interest Rates Unchanged, But a June Hike Is Likely"
02/05/2018, Finance ,CVS Says It’s Still ‘Moving Forward’ With $68 Billion Aetna Deal
02/05/2018, Finance ,How ‘Secret Fares’ and Mobile Apps Will Soon Change the Way You Fly
02/05/2018, Finance ,"Term Sheet — Wednesday, May 2"
02/05/2018, Finance ,"Carl Icahn Ousts Xerox Boss, Putting $6.1 Billion Fujifilm Deal in Limbo"
03/05/2018, Finance ,"What’s Stopping Female Jobseekers From Landing Interviews? Their ‘A’ Grades, Says Study"
03/05/2018, Finance ,Why Jay-Z Is Being Subpoenaed by the SEC
03/05/2018, Finance ,"Term Sheet — Thursday, May 3"
03/05/2018, Finance ,Richard Branson Enters a New Frontier: Private Equity
03/05/2018, Finance ,"Tesla Shares Keep Tanking After Elon Musk Disses Wall Street Analysts’ ‘Boring, Bonehead Questions’"
03/05/2018, Finance ,China’s Xiaomi Files in Hong Kong for the World’s Biggest IPO Since 2014
04/05/2018, Finance ,Here Are 5 Things to Watch For at the 2018 Berkshire Hathaway Shareholder Meeting
04/05/2018, Finance ,Here’s How to Watch Warren Buffett’s 2018 Berkshire Hathaway Shareholder Meeting
04/05/2018, Finance ,Unemployment Is Its Lowest in 17 Years. Here’s Why That’s Great for the Disabled and Ex-Cons
04/05/2018, Finance ,"How to Lose $700 Million, Theranos-Style"
04/05/2018, Finance ,"Term Sheet — Friday, May 4"
04/05/2018, Finance ,Alibaba Says Its Going to Grow Almost 50% Faster Than Wall Street Expected
04/05/2018, Finance ,"Elon Musk’s Wall Street-Bashing Sunk Tesla Stock, But He Still Has More to Say"
04/05/2018, Finance ,Why Xerox’s CEO Is Staying and Its Merger With Fujifilm Might Be Back On
05/05/2018, Finance ,Why Warren Buffett Thinks Buying Microsoft Stock ‘Would Be a Mistake’
05/05/2018, Finance ,Why Elon Musk and Warren Buffett Are Suddenly Trolling Each Other Over See’s Candies
05/05/2018, Finance ,"Berkshire Hathaway, Amazon and JPMorgan Are Close to Hiring a CEO for Their Healthcare Venture"
05/05/2018, Finance ,California’s Economy Is Now Bigger Than All of the U.K.
05/05/2018, Finance ,Warren Buffett’s Berkshire Hathaway Just Posted Its First Loss in 9 Years. Here’s Why
07/05/2018, Finance ,Why Warren Buffett Loves Apple Stock
07/05/2018, Finance ,The 13 Best Warren Buffett Quotes from the Berkshire Hathaway Meeting
07/05/2018, Finance ,The 21 Best Charlie Munger Quotes From the Berkshire Hathaway Meeting
07/05/2018, Finance ,‘World of Warcraft’ Currency Is Now Worth 7 Times as Much as Venezuela’s Cash
07/05/2018, Finance ,"Forget the Bolívar: In Venezuela, Bartering Is the New Economy"
07/05/2018, Finance ,"Term Sheet — Monday, May 7"
07/05/2018, Finance ,Why Nestle Is Paying $7.2 Billion to Sell Starbucks Coffee
08/05/2018, Finance ,"Term Sheet — Tuesday, May 8"
08/05/2018, Finance ,Comcast Is Still Trying to Bust Up the Fox-Disney Marriage. Here’s How They Could Do It
09/05/2018, Finance ,"The Highest Paid CEO on the S&P 500 Made 2,000 Times the Average U.S. Worker in 2017"
09/05/2018, Finance ,"Term Sheet — Wednesday, May 9"
09/05/2018, Finance ,Walmart’s $16 Billion Flipkart Deal Just Created 2 New Billionaires
09/05/2018, Finance ,People Love MoviePass’s Prices. That’s Why It Might Not Survive
10/05/2018, Finance ,Robinhood Trading App Surpasses E*Trade in Total Users
10/05/2018, Finance ,"Term Sheet — Thursday, May 10"
10/05/2018, Finance ,‘A Milestone Moment.’ Why RBS Is So Happy to Pay the U.S. a $4.9 Billion Fine
11/05/2018, Finance ,Why VC Tim Draper Keeps Defending Theranos CEO Elizabeth Holmes
11/05/2018, Finance ,"Term Sheet — Friday, May 11"
11/05/2018, Finance ,The Trump Administration Changed Taxes on Cash Held Overseas. Now Firms Have Stopped Reporting It
12/05/2018, Finance ,The 10 Biggest Surprises From the $828 Million Rockefeller Auction
14/05/2018, Finance ,"Term Sheet — Monday, May 14"
14/05/2018, Finance ,Xerox Has Killed Its Merger With Fujifilm and Carl Icahn Is ‘Extremely Pleased’
15/05/2018, Finance ,"Term Sheet — Tuesday, May 15"
16/05/2018, Finance ,"Term Sheet — Wednesday, May 16"
16/05/2018, Finance ,SoftBank’s Founder Has Plans for Another Ginormous Tech Investment Fund
17/05/2018, Finance ,Wells Fargo’s Latest Misconduct Involves Its Corporate Customers
17/05/2018, Finance ,"Term Sheet — Thursday, May 17"
18/05/2018, Finance ,"Term Sheet — Friday, May 18"
18/05/2018, Finance ,Crypto Bros’ Lamborghini Obsession Morphs Into Aspirational Parody
18/05/2018, Finance ,Japanese Cryptocurrency Exchange Coincheck Is Plotting Its Comeback
19/05/2018, Finance ,It Was an Unlucky Week to Throw $8.8 Billion at the Stock Market
21/05/2018, Finance ,Here Are the Fortune 500’s 10 Most Valuable Companies
21/05/2018, Finance ,"Term Sheet — Monday, May 21"
21/05/2018, Finance ,Why General Electric Is Spinning Off Its Transportation Business
21/05/2018, Finance ,Investors Are Really Excited About the Pause in U.S.-China Trade War
21/05/2018, Finance ,Paper Jam! How Carl Icahn And a Billionaire Partner Blocked Xerox’s Merger with Fujifilm
22/05/2018, Finance ,These Companies Have Made the Fortune 500 Every Year Since 1955
22/05/2018, Finance ,"Michael Cohen’s Taxi Partner Enters Plea Deal, Suggesting Cooperation"
22/05/2018, Finance ,Ex-Valeant Executive Guilty of Taking Pharmacy CEO’s Bribe
22/05/2018, Finance ,"Term Sheet — Tuesday, May 22"
23/05/2018, Finance ,Freezing Your Credit Will Be Free Later This Year
23/05/2018, Finance ,Deutsche Bank Weighs Cutting 10% of Jobs
23/05/2018, Finance ,"Term Sheet — Wednesday, May 23"
24/05/2018, Finance ,Gold and Defense Stocks Rise as Donald Trump Cancels North Korea Summit
24/05/2018, Finance ,"People Born in the 1980s Are the Worst Off Financially, Study Finds"
24/05/2018, Finance ,"Term Sheet — Thursday, May 24"
24/05/2018, Finance ,China May Be About to Cut Import Tariffs on Lipstick and Food and Everything in Between
24/05/2018, Finance ,Uber’s Revenue Spiked 70% Last Quarter. But It Still Lost Tons of Money
25/05/2018, Finance ,Xiaomi Said to Seek June 7 Listing Hearing for $10 Billion IPO
25/05/2018, Finance ,"Riskiest Junk Bonds Are Most ‘Mispriced’ Since 2007, Goldman Says"
25/05/2018, Finance ,"Term Sheet — Friday, May 25"
25/05/2018, Finance ,Finance App Albert Raises $5 Million To Help You Solve Your Money Problems
25/05/2018, Finance ,How This Year’s Fortune 500 Breaks One Record After the Next
26/05/2018, Finance ,PayPal Will Integrate Across All Google Services Soon
27/05/2018, Finance ,Alberto Could Bring $1 Billion in Economic Losses to Gulf Coast
29/05/2018, Finance ,"Term Sheet — Tuesday, May 29"
30/05/2018, Finance ,Fed Releases Proposal for Easing Volcker Rule Trading Limits
30/05/2018, Finance ,Navarro Hits at Mnuchin for U.S.-China Trade War Comments
30/05/2018, Finance ,"Term Sheet — Wednesday, May 30"
30/05/2018, Finance ,The U.S. Investor Behind the Magnitsky Act Was Arrested in Spain on a Russian Warrant
31/05/2018, Finance ,"J.P. Morgan CEO Jamie Dimon Is Still Very, Very Well Paid"
31/05/2018, Finance ,"Term Sheet — Thursday, May 31"
31/05/2018, Finance ,Will He or Won’t He? Airbnb CEO Brian Chesky Teases a 2019 IPO
01/06/2018, Finance ,Why Prominent Seed Firm SV Angel Will Not Raise a New Fund
01/06/2018, Finance ,"Term Sheet — Friday, June 1"
01/06/2018, Finance ,A Goldman Sachs VP Is Facing Criminal Charges Over Insider Trading. Here’s How His Scam Supposedly Worked
04/06/2018, Finance ,Why Andreessen Horowitz Wrote GitHub’s First Big Check Back in 2012
04/06/2018, Finance ,"Term Sheet — Wednesday, June 4"
04/06/2018, Finance ,A Lunch With Warren Buffett Just Fetched $3 Million at Auction
05/06/2018, Finance ,Josh Kushner’s Thrive Capital Strikes Gold in GitHub Deal
05/06/2018, Finance ,Microsoft’s $7.5 Billion GitHub Acquisition Is One of Its Biggest Bets Yet
05/06/2018, Finance ,"A 9,500% Stock Surge Turns Janitors Into Millionaires"
05/06/2018, Finance ,Not Prepared for Retirement? Here’s a Solution: Don’t Retire
05/06/2018, Finance ,"Term Sheet — Tuesday, June 5"
05/06/2018, Finance ,Twitter Stock Pops Even Higher on News That It Will Replace Monsanto on the S&P 500
06/06/2018, Finance ,"Term Sheet — Wednesday, June 6"
06/06/2018, Finance ,"Founders Fund Partner Talks Privacy, Facebook, and His Time at Peter Thiel’s Secretive Data Company"
07/06/2018, Finance ,Kevin Hartz Is Stepping Down as Partner at Founders Fund
07/06/2018, Finance ,"Tax Reform Is Lifting Profits, but Beware Wall Street’s Blue Sky Forecasts"
07/06/2018, Finance ,Canada Is Set to Legalize Recreational Weed Today. Here’s Why Marijuana Stock Investors Aren’t Cheering
07/06/2018, Finance ,Crypto’s 32-Year-Old Billionaire Mining King Jihan Wu Is Mulling IPO
07/06/2018, Finance ,"Term Sheet — Thursday, June 7"
07/06/2018, Finance ,Warren Buffett and Jamie Dimon Really Want Companies to Stop Giving Quarterly Earnings Guidance
08/06/2018, Finance ,"Term Sheet — Friday, June 8"
08/06/2018, Finance ,‘That Price Is Too High.’ Carl Icahn Thinks Xerox Is Worth $40 a Share But Fujifilm’s CEO Won’t Pay Up
08/06/2018, Finance ,Jack Ma’s Chinese Fintech Firm Just Raised So Much Money It’s Now Worth More Than Goldman Sachs
11/06/2018, Finance ,Workday Snaps Adaptive Insights Off the IPO Market
11/06/2018, Finance ,KKR Will Buy Envision Healthcare for an Eye-Popping $5.5 Billion
11/06/2018, Finance ,"Term Sheet — Monday, June 11"
11/06/2018, Finance ,Watch Out: This Could Be the World Economy’s Most Important Week of 2018
12/06/2018, Finance ,Discover to Offer Full-Ride Online Bachelor’s Degrees
12/06/2018, Finance ,Merrill Lynch to Pay $15.7 Million for Duping Mortgage Bond Customers
12/06/2018, Finance ,A Front-Row Seat for the AT&T-Time Warner Merger Ruling Costs Up to $860
12/06/2018, Finance ,Meituan Is Said to Plan $6 Billion IPO Filing This Month
12/06/2018, Finance ,"Term Sheet — Tuesday, June 12"
13/06/2018, Finance ,AT&T Win Unleashes Wave of Investors’ Bets on Next Big M&A Deal
13/06/2018, Finance ,"Term Sheet — Wednesday, June 13"
14/06/2018, Finance ,"Term Sheet — Thursday, June 14"
14/06/2018, Finance ,This Under-the-Radar Company Has Been Aggressively Buying Up Businesses — and It’s Working
15/06/2018, Finance ,"Dow Slips 200 Points, Soybean Prices Fall as Trump Slaps 25% Tariff on China"
15/06/2018, Finance ,"Term Sheet — Friday, June 15"
16/06/2018, Finance ,Citibank Fined $100 Million for Manipulating Key Global Interest Rate
18/06/2018, Finance ,"Term Sheet — Monday, June 18"
18/06/2018, Finance ,Cryptocurrencies ‘Do Not Work as Money:’ New Bank Report Issues the Ultimate Bitcoin Diss
19/06/2018, Finance ,Goldman Sachs CEO Lloyd Blankfein Calls Immigrant Family Separations ‘Horrible’ and “Tragic’
19/06/2018, Finance ,"Term Sheet — Tuesday, June 19"
19/06/2018, Finance ,Fujifilm Is Suing Xerox for $1 Billion for Walking Away From Their Merger
20/06/2018, Finance ,Elon Musk Shoots for Mars — And Strains His Balance Sheet
20/06/2018, Finance ,Mark Zuckerberg on Brink of Eclipsing Warren Buffett as World’s Third-Richest Person
20/06/2018, Finance ,"With GE Booted, These 30 Companies Will Soon Form the Dow Jones Industrial Average"
